{"schema":"nightshift.casework-run/v1","projection_digest":"sha256:150cfb77cfa62113ff65da66b4f14017a5542721ba2859fbcf865dc415aec111","run_id":"01e9f695fd89af789023cea0b9220a8e5178f807066779c9f7a4b7b3b67d4ba7","packet":{"packet_id":"nightshift-20260829-autonomous-convergence","packet_digest":"sha256:01e9f695fd89af789023cea0b9220a8e5178f807066779c9f7a4b7b3b67d4ba7","created_at":"2026-08-29T17:00:00+00:00","current_until":"2026-08-30T12:00:00+00:00","source_bytes_digest":"sha256:e9581778c89b3a8bfc8710adc95ba1f4446900c29f0884988e2be33b227b9a10","integrity":"VALID_PACKET_INTEGRITY","currentness_at_receipt_snapshot":"CURRENT","currentness_evaluated_at":"2026-08-31T00:00:00+00:00","currentness_now":"EXPIRED","repository_custody":[{"derived_id":"sha256:6b1ea0f47b73aa697c60ed5562b5429d505e4ec767d00c0c4511f1107be2adb4","repository":"cartography","path":"/data/git/cartography","branch":"campaign/axolotl-design-custody-2026-08-27","commit":"9bdaae8587a2d6419c12d83ed136a4ee7da0a048","remote":"origin","remote_commit":"9bdaae8587a2d6419c12d83ed136a4ee7da0a048","worktree_clean":false,"discrepancy":"Four pre-existing untracked files; separate campaign-constellation branch has sole local commit 48255df101670ae43514b2b1475aeb8900195c8b."},{"derived_id":"sha256:2cb81e1196f8a88e09ccd53bf6c391d236ba305a0487856a60e823e99421c8c0","repository":"nightshift","path":"/data/git/nightshift","branch":"campaign/governed-campaign-loop-v0-qualification","commit":"999a91d92b56e655906a31a1a4e914ccaf1ecbfb","remote":"origin","remote_commit":null,"worktree_clean":true,"discrepancy":"Seven predecessor commits were sole-local at run entry; successor branch push must custody them."},{"derived_id":"sha256:49d1021b0cb6de95fa3e033033ea1370547652c532875a536f0aedc5a4b7a27a","repository":"switchyard","path":"/data/git/switchyard","branch":"master","commit":"3f719451f2daca88bdb4e87e8e8142f22cc9df7d","remote":"origin","remote_commit":null,"worktree_clean":true,"discrepancy":"Configured local-bundle origin is absent; no authoritative forge destination is registered."},{"derived_id":"sha256:1009bacf81cf9a316bd99b6298c5989758ecf39cb116bd904dc38e2f6027e764","repository":"ag_ng-glass-heron","path":"/data/git/ag_ng","branch":"campaign/governed-campaign-loop-v1-worker-vm","commit":"5c8b22b77193798f25298b02758ac3caa3a8fe24","remote":"origin","remote_commit":null,"worktree_clean":true,"discrepancy":"Campaign branch absent remotely."},{"derived_id":"sha256:20eca9b31015fea9aa436afe784e4f3f75c725771e6944892e8b4bf396ed4dda","repository":"ag_ng-authorization","path":"/tmp/ag-ng-agc","branch":"campaign/external-occurrence-authorization","commit":"4f36e9570d49f21e32e7f7b5f84e8055161ee12f","remote":"private-origin","remote_commit":"4f36e9570d49f21e32e7f7b5f84e8055161ee12f","worktree_clean":true,"discrepancy":"Local clone origin points to operational clone; private remote verified separately."},{"derived_id":"sha256:5df5e0666ef6238f8e674bfafc6be67b72b61bcd914976665781acc0c0f0cc9c","repository":"codex-authorization","path":"/tmp/codex-agc","branch":"campaign/ag-exact-occurrence-authorization","commit":"5de6a3336f1556559ec8db5593a907f6493019e3","remote":"private-origin","remote_commit":"5de6a3336f1556559ec8db5593a907f6493019e3","worktree_clean":true,"discrepancy":"Operational /data/git/codex is dirty and must not be used."},{"derived_id":"sha256:dfed1fe531de8b3bc68fd1a2df2f60ca16777b08e6199503dc3becee4e18f521","repository":"porter","path":"/data/git/porter","branch":"campaign/governed-campaign-loop-v1-exact-endpoint","commit":"a838501de2fc220bfc838904733114e41124b744","remote":"origin","remote_commit":null,"worktree_clean":true,"discrepancy":"Campaign branch absent remotely."},{"derived_id":"sha256:f9cfed7370b77eefb2659ead1ccdfb6cf47cb4e72b22f2938b8928b004bc23f8","repository":"campaign-driver-ng","path":"/data/git/campaign-driver-ng","branch":"campaign/governed-campaign-loop-v1-worker-vm","commit":"0823f1b1b81e94512cca2bdf861ad74d64162aa1","remote":null,"remote_commit":null,"worktree_clean":true,"discrepancy":"No authoritative remote."},{"derived_id":"sha256:bfa0336891609654f121f5508446e9247f6882b6f92bb7907a9a49beb3de1f1e","repository":"nq-ng-caliper","path":"/data/git/nq-ng-caliper","branch":"campaign/passive-vm-release-reproducibility-and-lifecycle-v1","commit":"74127fc0a121a0408ce6b5262ddf22f5e2d6f839","remote":"origin","remote_commit":null,"worktree_clean":true,"discrepancy":"Linked worktree of shared nq-ng repository; campaign branch absent remotely."},{"derived_id":"sha256:de62376ce99f6ef2937c4bf0c037ca89f6263144dc34bbbf68c40b7d0b9d2eda","repository":"nq-ng-bedrock","path":"/data/git/nq-ng-bedrock","branch":"campaign/k3s-live-origin-capacity-qualification-v1","commit":"5fc7cc8212eb182bba54a2c92b7b37bd44b0cf69","remote":"origin","remote_commit":null,"worktree_clean":true,"discrepancy":"Linked worktree of shared nq-ng repository; campaign branch absent remotely."},{"derived_id":"sha256:a4e8da3d2776907fc6b3ead553846f1f652bd7c3c2ef9dd5e2386f3767211a72","repository":"nq-classic-lanternwake","path":"/data/git/.worktrees/nq-lanternwake-monitor-integration","branch":"campaign/lanternwake-constellation-runtime-monitor-integration","commit":"aef117f7944288d5ccb130e1845ad3b23fdc6035","remote":"origin","remote_commit":"aef117f7944288d5ccb130e1845ad3b23fdc6035","worktree_clean":true,"discrepancy":null},{"derived_id":"sha256:849322f4572a20e33469f585cfe004bdb71015995d4f1340992934ed46c24b0b","repository":"nq-ng-canonical","path":"/data/git/skunkworks/nq-ng","branch":"main","commit":"59abd3bcb2d0cc30657a659b3ebc57b981289d9f","remote":"origin","remote_commit":"59abd3bcb2d0cc30657a659b3ebc57b981289d9f","worktree_clean":false,"discrepancy":"Primary checkout is on unrelated branch 675e247 with pre-existing untracked campaign records; use isolated main worktree."},{"derived_id":"sha256:49c44ac35366828b61d6c50f78aa81b1b611fadac0c5361db0f74ede2fdb92da","repository":"civild-copper-lantern","path":"/tmp/copper-lantern-civild","branch":"campaign/copper-lantern-same-version-reference-deployment","commit":"08b7dbe5b390b099b03a576d1f694c9d14438b05","remote":"origin","remote_commit":"08b7dbe5b390b099b03a576d1f694c9d14438b05","worktree_clean":true,"discrepancy":null},{"derived_id":"sha256:36f8e79848a8814f252dac3cf285d36fe7133b4b4a7a7c71bfc1a878681c8445","repository":"nq-ng-glasshopper","path":"/data/git/nq-ng-glasshopper","branch":"campaign/passive-linode-canonical-relation-relaunch-v1","commit":"460d97c01fedb507ffad090c46437a8d833f93e7","remote":"origin","remote_commit":null,"worktree_clean":true,"discrepancy":"Read-only until 2026-08-29T21:45:05Z; linked worktree of shared nq-ng repository."}]},"receipts":{"schema":"nightshift.run-receipts/v1","updated_at":{"recognized_string":"2026-08-29T22:20:44Z","recognized_rfc3339":"2026-08-29T22:20:44+00:00"},"source_bytes_digest":"sha256:b8894383f833a94e79b9fbfb73bc926ccddef1e6169cadab36b1d5668659a637","validation":"VALID_RENDERER_COMPATIBLE_RECEIPT_SNAPSHOT"},"summary":{"work_item_count":14,"state_counts":{"CLOSEOUT-COMPLETE-NOT-QUALIFIED":1,"ENTRY-BLOCKED-NOT-STARTED":1,"NOT-STARTED-BLOCKED-PREREQUISITE":1,"QUALIFIED":4,"QUALIFIED-CODE-INTEGRATION-STOPPED":1,"QUALIFIED-LOCAL-CUSTODY":1,"QUALIFIED-LOCAL-LIVE-ROUTE-UNQUALIFIED":1,"QUALIFIED-VIA-SUCCESSOR":1,"QUALIFIED-WITH-CUSTODY-LIMITATION":1,"TERMINAL-NOT-QUALIFIED":2},"unrecognized_state_count":0,"human_question_count":6,"packet_custody_discrepancy_count":12},"work_items":[{"derived_id":"sha256:ca0c5713fb4fde3ef1e013e928a28346d437ea53222338834ad66a502e5f5fac","id":"packet-v1","track":"nightshift","campaign":{"codename":"VELVET-ORRERY","canonical_slug":"nightshift-immutable-run-packet-v1-20260829"},"predecessor_lineage":[],"dependencies":[],"exact_work_refs":[],"entry_predicates":["canonical Nightshift ownership verified","all starting custody discrepancies recorded"],"allowed_mutation_surfaces":["nightshift packet module, schema, fixtures, qualification records"],"forbidden_actions":["default-branch merge","published-history rewrite","production activation","replay of a consumed occurrence","inference of success from missing evidence or process exit"],"acceptance_tests":["JCS digest validation","normative mutation changes digest","unknown work item, stale packet, digest mismatch fail closed"],"stop_conditions":["canonical ownership conflict","protected promotion required"],"expected_receipts":["packet validation receipt","qualification report"],"closeout_requirements":["commit and push campaign branch","clean worktree","non-authorizing summary"],"model_routing":{"class":"large","reason":"Cross-repository packet law and dependency graph.","maximum_mutating_workers":1},"outcome":{"state":{"recognized_string":"QUALIFIED"},"result_classification":{"recognized_string":"NIGHTSHIFT-ORIENTATION-PACKET-V1-IMPLEMENTATION-QUALIFIED"},"repositories":{"recognized_rows":[{"repository":"nightshift","branch":"campaign/velvet-orrery-nightshift-immutable-run-packet-v1-20260829","head":"ce6dd8ed84f6ba53edcf58788f90f5162cbc9844","push_status":"remote verified; packet implementation accepted at 8f858f2d942ff569d8422c0c9c66975a1a45fd1f"}]},"tests":{"recognized_strings":["packet tests: 17 passed","full cargo test --locked: passed","clippy all targets -D warnings: passed","report tests: 3 passed","schema, exact seal, domain digest, and no-actuation controls: passed"]},"evidence":{"recognized_strings":["qualification/nightshift-packet-v1/velvet-orrery/validation-receipt.v1.json","qualification/nightshift-packet-v1/velvet-orrery/QUALIFICATION.md","docs/working/roadmaps/falling_piano_resilience_validation.md"]},"live_or_production_mutations":{"recognized_strings":[]},"remaining_trigger":{"recognized_string":"optional promotion review; packet remains non-authorizing"},"next_lawful_action":{"recognized_string":"review the campaign branch and promotion dispositions without changing the sealed packet"}}},{"derived_id":"sha256:f2f5d58ef9af875c0b61bab937d6dd12558b7ea93592f7127528b16465de4775","id":"switchyard-transport","track":"agent-ope